{
  "schemaVersion": "hook-validation-ledger-v1",
  "generatedAtUtc": "2026-07-10T23:01:51.893Z",
  "coverageCatalogHash": "cc6adec3c4450733990c65e6eb0b9173890fbeb5c823c5fb99580580f36976f0",
  "hookCatalogIdentity": "66f12e0350a57a5e6a6c523f2524f875d4efcb209e25f1dbe92dbe6a1819d985",
  "callbackImplementationVersion": "progressive-hook-callback-v1",
  "callbackSchemaVersion": "hook-passive-evidence-v1",
  "validationBehaviorVersion": "validation-depths-v1",
  "updatedAtUtc": "2026-07-10T23:01:51.893Z",
  "initialMigrationPolicy": "Legacy v1.0.2 registration/callback observations are retained as history only and confer no compatibility-aware trust.",
  "candidates": [
    {
      "candidateId": "hook-crabps-onrep-islandrewardrarity",
      "hookPathFingerprint": "0e4b3a14b3dab4a518341a2e1bfc1f92904504ca44d5ab214b0d86673fb2f32d",
      "state": "untested",
      "highestValidatedDepth": 0,
      "trustedDepth": null,
      "cleanRuns": 0,
      "naturalCallbacks": 0,
      "hostCleanRuns": 0,
      "joinedClientCleanRuns": 0,
      "lifecycleTransitionRuns": 0,
      "evidenceSessions": [],
      "legacyObservationMigrated": true,
      "legacyObservationTrusted": false,
      "crashSuspectRuns": [],
      "compatibilityFingerprint": "",
      "hasUnmatchedBreadcrumb": false,
      "hasCorrelatedCrash": false,
      "hasNewUe4ssCallbackError": false,
      "reducerFixtureCovered": false
    },
    {
      "candidateId": "hook-crabpc-clientonpickeduppickup",
      "hookPathFingerprint": "a33cfe34b87b49e660a033efc3dabddfefef634dbe0ceec29b50b6fde78533a7",
      "state": "untested",
      "highestValidatedDepth": 0,
      "trustedDepth": null,
      "cleanRuns": 0,
      "naturalCallbacks": 0,
      "hostCleanRuns": 0,
      "joinedClientCleanRuns": 0,
      "lifecycleTransitionRuns": 0,
      "evidenceSessions": [],
      "legacyObservationMigrated": true,
      "legacyObservationTrusted": false,
      "crashSuspectRuns": [],
      "compatibilityFingerprint": "",
      "hasUnmatchedBreadcrumb": false,
      "hasCorrelatedCrash": false,
      "hasNewUe4ssCallbackError": false,
      "reducerFixtureCovered": false
    },
    {
      "candidateId": "hook-crabps-onrep-inventory",
      "hookPathFingerprint": "48ae98572cc4adc66795ae6bcbc1c297dc167db669a6297441f7dc1583f9eb85",
      "state": "untested",
      "highestValidatedDepth": 0,
      "trustedDepth": null,
      "cleanRuns": 0,
      "naturalCallbacks": 0,
      "hostCleanRuns": 0,
      "joinedClientCleanRuns": 0,
      "lifecycleTransitionRuns": 0,
      "evidenceSessions": [],
      "legacyObservationMigrated": true,
      "legacyObservationTrusted": false,
      "crashSuspectRuns": [],
      "compatibilityFingerprint": "",
      "hasUnmatchedBreadcrumb": false,
      "hasCorrelatedCrash": false,
      "hasNewUe4ssCallbackError": false,
      "reducerFixtureCovered": false
    },
    {
      "candidateId": "hook-crabps-onrep-crystals",
      "hookPathFingerprint": "9c9240e8d43f7c34ecde792710b67a8d0e4e965a1ba10ea6f9dcf9cdc755eda3",
      "state": "untested",
      "highestValidatedDepth": 0,
      "trustedDepth": null,
      "cleanRuns": 0,
      "naturalCallbacks": 0,
      "hostCleanRuns": 0,
      "joinedClientCleanRuns": 0,
      "lifecycleTransitionRuns": 0,
      "evidenceSessions": [],
      "legacyObservationMigrated": true,
      "legacyObservationTrusted": false,
      "crashSuspectRuns": [],
      "compatibilityFingerprint": "",
      "hasUnmatchedBreadcrumb": false,
      "hasCorrelatedCrash": false,
      "hasNewUe4ssCallbackError": false,
      "reducerFixtureCovered": false
    },
    {
      "candidateId": "hook-crabps-onrep-weaponda",
      "hookPathFingerprint": "20e0ce35282b70a91ba53804139562cdc12877778d319138d6b6a524e0669260",
      "state": "untested",
      "highestValidatedDepth": 0,
      "trustedDepth": null,
      "cleanRuns": 0,
      "naturalCallbacks": 0,
      "hostCleanRuns": 0,
      "joinedClientCleanRuns": 0,
      "lifecycleTransitionRuns": 0,
      "evidenceSessions": [],
      "legacyObservationMigrated": true,
      "legacyObservationTrusted": false,
      "crashSuspectRuns": [],
      "compatibilityFingerprint": "",
      "hasUnmatchedBreadcrumb": false,
      "hasCorrelatedCrash": false,
      "hasNewUe4ssCallbackError": false,
      "reducerFixtureCovered": false
    },
    {
      "candidateId": "hook-crabps-onrep-abilityda",
      "hookPathFingerprint": "741c7ab4c866d4bec55b0460caa7f15b0bd9632afad9d222466c1a4016df959a",
      "state": "untested",
      "highestValidatedDepth": 0,
      "trustedDepth": null,
      "cleanRuns": 0,
      "naturalCallbacks": 0,
      "hostCleanRuns": 0,
      "joinedClientCleanRuns": 0,
      "lifecycleTransitionRuns": 0,
      "evidenceSessions": [],
      "legacyObservationMigrated": true,
      "legacyObservationTrusted": false,
      "crashSuspectRuns": [],
      "compatibilityFingerprint": "",
      "hasUnmatchedBreadcrumb": false,
      "hasCorrelatedCrash": false,
      "hasNewUe4ssCallbackError": false,
      "reducerFixtureCovered": false
    },
    {
      "candidateId": "hook-crabps-onrep-meleeda",
      "hookPathFingerprint": "d281f5f2acd50a498d31eb273bce39138e0c5558ebc522d22bc64510e866a9ca",
      "state": "untested",
      "highestValidatedDepth": 0,
      "trustedDepth": null,
      "cleanRuns": 0,
      "naturalCallbacks": 0,
      "hostCleanRuns": 0,
      "joinedClientCleanRuns": 0,
      "lifecycleTransitionRuns": 0,
      "evidenceSessions": [],
      "legacyObservationMigrated": true,
      "legacyObservationTrusted": false,
      "crashSuspectRuns": [],
      "compatibilityFingerprint": "",
      "hasUnmatchedBreadcrumb": false,
      "hasCorrelatedCrash": false,
      "hasNewUe4ssCallbackError": false,
      "reducerFixtureCovered": false
    },
    {
      "candidateId": "hook-crabps-serverincrementnuminventoryslots",
      "hookPathFingerprint": "cc5a31a65fcbfac4de4e8bb4d19ace1ada534e6639499fd623e16ac1e8656587",
      "state": "untested",
      "highestValidatedDepth": 0,
      "trustedDepth": null,
      "cleanRuns": 0,
      "naturalCallbacks": 0,
      "hostCleanRuns": 0,
      "joinedClientCleanRuns": 0,
      "lifecycleTransitionRuns": 0,
      "evidenceSessions": [],
      "legacyObservationMigrated": true,
      "legacyObservationTrusted": false,
      "crashSuspectRuns": [],
      "compatibilityFingerprint": "",
      "hasUnmatchedBreadcrumb": false,
      "hasCorrelatedCrash": false,
      "hasNewUe4ssCallbackError": false,
      "reducerFixtureCovered": false
    },
    {
      "candidateId": "hook-crabinteractpickup-onrep-ispickupdeactivated",
      "hookPathFingerprint": "ec568343b6f44f581beb7e6d2f0271d0a159e546e777eb74a173dc1fa8bd5b10",
      "state": "untested",
      "highestValidatedDepth": 0,
      "trustedDepth": null,
      "cleanRuns": 0,
      "naturalCallbacks": 0,
      "hostCleanRuns": 0,
      "joinedClientCleanRuns": 0,
      "lifecycleTransitionRuns": 0,
      "evidenceSessions": [],
      "legacyObservationMigrated": true,
      "legacyObservationTrusted": false,
      "crashSuspectRuns": [],
      "compatibilityFingerprint": "",
      "hasUnmatchedBreadcrumb": false,
      "hasCorrelatedCrash": false,
      "hasNewUe4ssCallbackError": false,
      "reducerFixtureCovered": false
    },
    {
      "candidateId": "hook-crabinteractpickup-onrep-numtimespickedup",
      "hookPathFingerprint": "4f872e8406ba825cd135f399ca02ad1e5c8d3f291fb3dbfb3ff57e67e4b96cc2",
      "state": "untested",
      "highestValidatedDepth": 0,
      "trustedDepth": null,
      "cleanRuns": 0,
      "naturalCallbacks": 0,
      "hostCleanRuns": 0,
      "joinedClientCleanRuns": 0,
      "lifecycleTransitionRuns": 0,
      "evidenceSessions": [],
      "legacyObservationMigrated": true,
      "legacyObservationTrusted": false,
      "crashSuspectRuns": [],
      "compatibilityFingerprint": "",
      "hasUnmatchedBreadcrumb": false,
      "hasCorrelatedCrash": false,
      "hasNewUe4ssCallbackError": false,
      "reducerFixtureCovered": false
    },
    {
      "candidateId": "hook-crabinteractpickup-onrep-pickupinfo",
      "hookPathFingerprint": "a5453dfe4cbae6f2afaf77b77abd8e11e404fe44de83c294134251ecb636b73b",
      "state": "untested",
      "highestValidatedDepth": 0,
      "trustedDepth": null,
      "cleanRuns": 0,
      "naturalCallbacks": 0,
      "hostCleanRuns": 0,
      "joinedClientCleanRuns": 0,
      "lifecycleTransitionRuns": 0,
      "evidenceSessions": [],
      "legacyObservationMigrated": true,
      "legacyObservationTrusted": false,
      "crashSuspectRuns": [],
      "compatibilityFingerprint": "",
      "hasUnmatchedBreadcrumb": false,
      "hasCorrelatedCrash": false,
      "hasNewUe4ssCallbackError": false,
      "reducerFixtureCovered": false
    },
    {
      "candidateId": "hook-craboverlappickup-onrep-pickedupbyc",
      "hookPathFingerprint": "dc2fdb36eb86f3710dfadf043c8e21e1c58aea528362168332062b5f017bf578",
      "state": "untested",
      "highestValidatedDepth": 0,
      "trustedDepth": null,
      "cleanRuns": 0,
      "naturalCallbacks": 0,
      "hostCleanRuns": 0,
      "joinedClientCleanRuns": 0,
      "lifecycleTransitionRuns": 0,
      "evidenceSessions": [],
      "legacyObservationMigrated": true,
      "legacyObservationTrusted": false,
      "crashSuspectRuns": [],
      "compatibilityFingerprint": "",
      "hasUnmatchedBreadcrumb": false,
      "hasCorrelatedCrash": false,
      "hasNewUe4ssCallbackError": false,
      "reducerFixtureCovered": false
    },
    {
      "candidateId": "hook-crabplayerc-multicastinteract",
      "hookPathFingerprint": "f24c1cb15f59c087128e867608ec3a9e76a87f73eac138e35296c8959d0cdc4d",
      "state": "untested",
      "highestValidatedDepth": 0,
      "trustedDepth": null,
      "cleanRuns": 0,
      "naturalCallbacks": 0,
      "hostCleanRuns": 0,
      "joinedClientCleanRuns": 0,
      "lifecycleTransitionRuns": 0,
      "evidenceSessions": [],
      "legacyObservationMigrated": true,